{
  "schema": "ls.multi-session.route-profile.v0.1",
  "route_id": "receipt-gated-event-route",
  "transport": "append_only_log",
  "durable_history": true,
  "per_session_offsets": true,
  "invalidates_cached_plans": true,
  "validates_producer": true,
  "validates_generation": true,
  "deduplicates_event_ids": true,
  "requires_verified_receipt": true,
  "replays_on_recovery": true,
  "human_relay": false,
  "recovery_time_ms": 1200,
  "event_to_replan_latency_ms": 700,
  "implementation_complexity_units": 7
}
