{
  "schema": "ls.multi-session.route-profile.v0.1",
  "route_id": "human-relay",
  "transport": "manual",
  "durable_history": false,
  "per_session_offsets": false,
  "invalidates_cached_plans": true,
  "validates_producer": false,
  "validates_generation": false,
  "deduplicates_event_ids": false,
  "requires_verified_receipt": false,
  "replays_on_recovery": false,
  "human_relay": true,
  "recovery_time_ms": 30000,
  "event_to_replan_latency_ms": 15000,
  "implementation_complexity_units": 1
}
